{
	"$schema": "http://json-schema.org/draft-07/schema#",
	"$id": "https://bombhopper.io/level.schema.json",
	"definitions": {
		"start_timing": {
			"type": "integer",
			"minimum": 0
		}
	},
	"title": "Level",
	"description": "A BombHopper.io level",
	"type": "object",
	"additionalProperties": false,
	"required": ["name", "timings", "entities"],
	"properties": {
		"name": {
			"type": "string",
			"description": "The level's name",
			"minLength": 1
		},
		"timings": {
			"type": "array",
			"items": [
				{
					"description": "2 stars",
					"$ref": "#/definitions/start_timing"
				},
				{
					"description": "3 stars",
					"$ref": "#/definitions/start_timing"
				}
			],
			"minItems": 2,
			"order": "desc",
			"additionalItems": false
		},
		"formatVersion": {
			"type": "integer",
			"description": "The version number of the schema the file corresponds to",
			"minimum": 0
		},
		"entities": {
			"type": "array",
			"items": {
				"$ref": "entity.schema.json#"
			}
		}
	}
}
