{
	"name": "My level",
	"timings": [
		0,
		0
	],
	"entities": [
		{
			"type": "text",
			"params": {
				"x": 500,
				"y": 300,
				"copy": {
					"en": "This is the default level!\nEdit it to your liking.",
					"fr": "Voici le niveau par défaut\nÉdite comme il te plait."
				},
				"anchor": {
					"x": 0.5,
					"y": 0.5
				}
			}
		},
		{
			"type": "normal",
			"params": {
				"vertices": [
					{
						"x": 720,
						"y": 600
					},
					{
						"x": 720,
						"y": 660
					},
					{
						"x": 840,
						"y": 660
					},
					{
						"x": 840,
						"y": 600
					}
				],
				"isStatic": true
			}
		},
		{
			"type": "ice",
			"params": {
				"vertices": [
					{
						"x": 60,
						"y": 360
					},
					{
						"x": 60,
						"y": 600
					},
					{
						"x": 720,
						"y": 600
					},
					{
						"x": 720,
						"y": 540
					},
					{
						"x": 480,
						"y": 540
					},
					{
						"x": 300,
						"y": 420
					},
					{
						"x": 180,
						"y": 420
					}
				],
				"isStatic": true
			}
		},
		{
			"type": "endpoint",
			"params": {
				"x": 900,
				"y": 360,
				"isStatic": true,
				"rightFacing": true,
				"angle": 0
			}
		},
		{
			"type": "player",
			"params": {
				"x": 240,
				"y": 400,
				"angle": 0,
				"isStatic": false,
				"magazine": [
					"grenade",
					"bullet"
				]
			}
		},
		{
			"type": "player",
			"params": {
				"x": 240,
				"y": 400,
				"angle": 0,
				"isStatic": false,
				"infiniteAmmo": "grenade"
			}
		},
		{
			"type": "normal",
			"params": {
				"vertices": [
					{
						"x": 60,
						"y": 240
					},
					{
						"x": 120,
						"y": 240
					},
					{
						"x": 120,
						"y": 300
					},
					{
						"x": 60,
						"y": 300
					}
				],
				"isStatic": false
			}
		}
	],
	"formatVersion": 0
}
